{
  "name": "Lobby",
  "abiName": "Lobby",
  "desc": "",
  "source": "https://github.com/rainprotocol/rain-protocol",
  "alias": "lobby",
  "methods": [
    {
      "name": "initialize",
      "abiName": "initialize",
      "desc": "Initialize a Lobby Contract",
      "inputs": [
        {
          "name": "Ref must agree",
          "abiName": "refMustAgree",
          "desc": "If `true` the ref must agree to be the ref before ANY players can join. This guards against the ref being entirely unaware of the lobby and therefore unlikely to sign any data beyond generic results. This MAY be `false` if the outcome of the `Lobby` can be inferred by entirely generic data that the ref is likely to publish regardless of the `Lobby`, such as a winner list that can be produced upon demand from some API.",
          "path": "[11].inputs[1].components[0]"
        },
        {
          "name": "Referee",
          "abiName": "ref",
          "desc": "The ref is some address that is expected to provide signatures of the results that allow the `Lobby` to complete or move to invalid.",
          "path": "[11].inputs[1].components[1]"
        },
        {
          "name": "Token",
          "abiName": "token",
          "desc": "The token that fees and rewards will be denominated in.",
          "path": "[11].inputs[1].components[2]"
        },
        {
          "name": "Description",
          "abiName": "description",
          "desc": "IPFS hash or similar of description and rules etc. that can be in JSON for a GUI.",
          "path": "[11].inputs[1].components[4]"
        },
        {
          "name": "Timeout duration",
          "abiName": "timeoutDuration",
          "desc": "Timeout the whole lobby after this many seconds.",
          "path": "[11].inputs[1].components[5]"
        }
      ],
      "expressions": [
        {
          "name": "Lobby expression",
          "abiName": "evaluableConfig",
          "desc": "The expression that defines the rules for this Lobby.",
          "path": "[11].inputs[1].components[3]",
          "signedContext": true,
          "callerContext": true
        }
      ]
    }
  ]
}
